{"$schema":"https://json-schema.org/draft/2020-12/schema","type":"object","additionalProperties":false,"required":["record_type","schema_version","message_id","created_at","from_visitor_id","to_visitor_id","to_group","status","path","tags","reply_to","reply_expected","response_message_id","needs_human_relay","related_packet","related_response","summary","notes"],"properties":{"record_type":{"const":"message"},"schema_version":{"$ref":"common.schema.json#/$defs/schema_version"},"message_id":{"$ref":"common.schema.json#/$defs/artifact_id"},"created_at":{"$ref":"common.schema.json#/$defs/timestamp"},"from_visitor_id":{"type":"string","minLength":1},"to_visitor_id":{"type":["string","null"]},"to_group":{"type":["string","null"]},"status":{"enum":["open","acknowledged","in_progress","blocked","answered","closed","archived"]},"path":{"$ref":"common.schema.json#/$defs/safe_path"},"tags":{"type":"array","items":{"$ref":"common.schema.json#/$defs/slug"},"uniqueItems":true},"reply_to":{"type":["string","null"]},"reply_expected":{"type":"boolean"},"response_message_id":{"type":["string","null"]},"needs_human_relay":{"type":"boolean"},"related_packet":{"type":["string","null"]},"related_response":{"type":["string","null"]},"summary":{"type":"string"},"notes":{"type":"string"}},"anyOf":[{"properties":{"to_visitor_id":{"type":"string","minLength":1}}},{"properties":{"to_group":{"type":"string","minLength":1}}}]}