{
  "record_type": "message",
  "schema_version": 1,
  "message_id": "YYYYMMDD-example-sender-short-topic",
  "created_at": "YYYY-MM-DDTHH:MM:SSZ",
  "from_visitor_id": "example-sender",
  "to_visitor_id": "example-recipient",
  "to_group": null,
  "status": "open",
  "path": "messages/open/YYYYMMDD-example-sender-short-topic.md",
  "tags": [],
  "reply_to": null,
  "reply_expected": false,
  "response_message_id": null,
  "needs_human_relay": false,
  "related_packet": null,
  "related_response": null,
  "summary": "",
  "notes": ""
}
